{
  "schema_version": 1,
  "label": "best_found",
  "job_id": "job-zero-copy",
  "solution_revision": 0,
  "created_at": "2026-09-10T00:00:00Z",
  "engine": {"version": "synthetic-fixture", "commit": "0000000"},
  "assets": {"object": {"schema_version": 1, "role": "object", "state": "accepted", "source": {"sha256": "aaaaaaaaaaaaaaaaaaaaaaaaaaaaaaaaaaaaaaaaaaaaaaaaaaaaaaaaaaaaaaaa", "path": "assets/object.stl", "units": "mm", "unit_scale_mm": 1}, "frame": {"source_bounds": {"min": [0,0,0], "max": [1,1,1]}, "source_to_local": [[1,0,0,-0.5],[0,1,0,-0.5],[0,0,1,-0.5],[0,0,0,1]]}, "dimensions_mm": [1,1,1], "diagnostics": {"status":"valid","messages":[]}, "accepted_solid": {"sha256":"bbbbbbbbbbbbbbbbbbbbbbbbbbbbbbbbbbbbbbbbbbbbbbbbbbbbbbbbbbbbbbbb","path":"assets/object.ply","format":"binary_little_endian_ply_f64_u32","vertex_count":8,"triangle_count":12}, "repair_record":null}},
  "container": {"kind":"box","dimensions_mm":[10,10,10]},
  "constraints": {"clearance_mm":{"pair":0,"wall":0},"orientation":{"mode":"fixed","quaternion_xyzw":[0,0,0,1]},"orientation_catalog_sha256":"cccccccccccccccccccccccccccccccccccccccccccccccccccccccccccccccc"},
  "search": {"resolved_settings":{"settings_version":1,"object_asset":{"source_sha256":"aaaaaaaaaaaaaaaaaaaaaaaaaaaaaaaaaaaaaaaaaaaaaaaaaaaaaaaaaaaaaaaa","accepted_solid_sha256":"bbbbbbbbbbbbbbbbbbbbbbbbbbbbbbbbbbbbbbbbbbbbbbbbbbbbbbbbbbbbbbbb"},"container":{"kind":"box","dimensions_mm":[10,10,10]},"clearance_mm":{"pair":0,"wall":0},"orientation":{"mode":"fixed","quaternion_xyzw":[0,0,0,1]},"search":{"preset":"synthetic-v1","seed":"0","deterministic":true,"work_budget":{"max_candidate_evaluations":1,"max_search_passes":1}},"resolution":{"mode":"manual","pitch_mm":1},"compute":{"backend":"cpu"},"resolved":{"pitch_mm":1,"orientation_catalog_sha256":"cccccccccccccccccccccccccccccccccccccccccccccccccccccccccccccccc","orientation_catalog_version":1,"backend":"cpu","thread_count":1}},"pitch_levels_mm":[1],"seed":"0","work_counts":{"candidate_evaluations":0,"search_passes":0},"run_segments":[{"segment_id":"segment-0","parent_solution_revision":null,"seed":"0","backend":"cpu","elapsed_seconds":0,"work_counts":{"candidate_evaluations":0,"search_passes":0},"search_state_reset":false,"rng":{"algorithm":"synthetic","state":"initial"},"resolved_settings":{"settings_version":1,"object_asset":{"source_sha256":"aaaaaaaaaaaaaaaaaaaaaaaaaaaaaaaaaaaaaaaaaaaaaaaaaaaaaaaaaaaaaaaa","accepted_solid_sha256":"bbbbbbbbbbbbbbbbbbbbbbbbbbbbbbbbbbbbbbbbbbbbbbbbbbbbbbbbbbbbbbbb"},"container":{"kind":"box","dimensions_mm":[10,10,10]},"clearance_mm":{"pair":0,"wall":0},"orientation":{"mode":"fixed","quaternion_xyzw":[0,0,0,1]},"search":{"preset":"synthetic-v1","seed":"0","deterministic":true,"work_budget":{"max_candidate_evaluations":1,"max_search_passes":1}},"resolution":{"mode":"manual","pitch_mm":1},"compute":{"backend":"cpu"},"resolved":{"pitch_mm":1,"orientation_catalog_sha256":"cccccccccccccccccccccccccccccccccccccccccccccccccccccccccccccccc","orientation_catalog_version":1,"backend":"cpu","thread_count":1}}}],"backend_transitions":[],"elapsed_seconds":0},
  "count":0,"placements":[],"validation":{"status":"valid","tolerance_mm":0,"authoritative_geometry_sha256":["bbbbbbbbbbbbbbbbbbbbbbbbbbbbbbbbbbbbbbbbbbbbbbbbbbbbbbbbbbbbbbbb"],"validator_version":"synthetic","kernel_version":"synthetic","checks":{"pair":"valid","containment":"valid","clearance":"valid"}},"metrics":{"solid_volume_mm3":1,"container_volume_mm3":1000,"utilization":0,"time_to_best_seconds":0,"peak_host_bytes":0,"peak_device_bytes":0,"termination_reason":"budget_exhausted"}
}
